{
  "formatVersion": "2",
  "createdBy": "anvil",
  "source": "anvil-session-export",
  "sessionId": "session-123",
  "objective": "Inspect and update the auth flow",
  "workingSummary": "Reader identified auth.rs and auth_test.rs as the key files.",
  "pendingSteps": [
    "Update validation logic",
    "Run focused auth tests"
  ],
  "relevantFiles": [
    "src/auth.rs",
    "tests/auth_test.rs"
  ],
  "pmModel": "qwen-coder-14b",
  "agentModels": {
    "reader": "qwen-coder-7b",
    "editor": null,
    "tester": null,
    "reviewer": null
  },
  "permissionMode": "workspace-write",
  "networkPolicy": "local-only"
}
